{
  "kicker": "반반 상한 검증가나다라마바사아",
  "title": "좌우 다섯 항목의 상한 대비가나다라마바사아자차카",
  "before": {
    "label": "AS-IS 상태가나",
    "title": "좌측 상태 제목이 두 줄까지 늘어나는 상한가나다라마바사",
    "items": [
      {
        "text": "좌측 항목 1 문장가나다라마바사아자차카타"
      },
      {
        "text": "좌측 항목 2 문장가나다라마바사아자차카타"
      },
      {
        "text": "좌측 항목 3 문장가나다라마바사아자차카타"
      },
      {
        "text": "좌측 항목 4 문장가나다라마바사아자차카타"
      },
      {
        "text": "좌측 항목 5 문장가나다라마바사아자차카타"
      }
    ],
    "summary": {
      "value": "12,345",
      "desc": "좌측 요약 설명가나"
    }
  },
  "after": {
    "label": "TO-BE 상태가나",
    "title": "우측 상태 제목이 두 줄까지 늘어나는 상한가나다라마바사",
    "items": [
      {
        "text": "우측 항목 1 문장가나다라마바사아자차카타"
      },
      {
        "text": "우측 항목 2 문장가나다라마바사아자차카타"
      },
      {
        "text": "우측 항목 3 문장가나다라마바사아자차카타"
      },
      {
        "text": "우측 항목 4 문장가나다라마바사아자차카타"
      },
      {
        "text": "우측 항목 5 문장가나다라마바사아자차카타"
      }
    ],
    "summary": {
      "value": "98,765",
      "desc": "우측 요약 설명가나"
    }
  },
  "gain": "개선 상한가",
  "note": {
    "pre": "풋노트 앞 구간 상한 검증가나다라",
    "strong": "강조 상한가나다라마바사",
    "post": "풋노트 뒤 구간 상한가나다라마바사"
  },
  "frame": {
    "brand": "ReportArchive 브랜드가나다라마바사",
    "idx": "07",
    "total": "07"
  }
}
